{"abi":{"header_sha256":"d0757ac4a2cb1655da8393e0d95d3022b034ce6a56f169bc1916dd3f64c59273","profile":"talon-native-c","required_symbols":["talon_open","talon_close","talon_run_sql","talon_run_sql_bin","talon_run_sql_param_bin","talon_kv_set","talon_kv_get","talon_kv_read_v1","talon_kv_del","talon_kv_incrby","talon_kv_setnx","talon_vector_insert","talon_vector_search","talon_vector_search_bin","talon_start_server","talon_stop_server","talon_persist","talon_free_string","talon_free_bytes","talon_last_error","talon_last_error_code","talon_clear_last_error","talon_build_manifest","talon_execute","talon_sql_context_new_v1","talon_sql_context_cancel_v1","talon_sql_context_free_v1","talon_exec_sql_context_v1"],"version":1},"artifact":{"archive":{"path":"libtalon-core-runtime-macos-arm64.tar.gz","sha256":"5ddb81131a2c0735e027a9a3ac721dbee60dd175dc9f412f5898d68d8c31c68d","size":5856764},"files":[{"path":"LICENSE.core","sha256":"e6a6068e4e178bd5262e1e31a64576e68dd023316c3b20f68cc67f4962d2d53e","size":7771},{"path":"NOTICE","sha256":"8f2751adb0b5f4a47b2f82bedb79ae66559e8fb53808445c550d2314c8388ad1","size":787},{"path":"libtalon.dylib","sha256":"85a38d4295fea131647e0dcebaed20e5b7e9c2b634f98112b1cb4bac8da36746","size":13622016},{"path":"talon.h","sha256":"d0757ac4a2cb1655da8393e0d95d3022b034ce6a56f169bc1916dd3f64c59273","size":28880}],"kind":"talon-core-native-runtime","platform":"macos-arm64"},"build":{"cargo":"cargo 1.92.0 (344c4567c 2025-10-21)","command":["build","--locked","--release","--lib"],"reproducibility":"exact source and toolchain with deterministic packaging; native code bytes are not claimed reproducible across mutable hosted runner images","runner":"macos-15","rustc":"rustc 1.92.0 (ded5c06cf 2025-12-08);binary: rustc;commit-hash: ded5c06cf21d2b93bffd5d884aa6e96934ee4234;commit-date: 2025-12-08;host: aarch64-apple-darwin;release: 1.92.0;LLVM version: 21.1.3;","source":"github-actions:darkmice/talon-bin/.github/workflows/build-enterprise-core.yml","target":"aarch64-apple-darwin","workflow_run_id":"38056242177"},"compatibility":{"binary_self_attestation":true,"runtime_verification":"ed25519-manifest+sha256-native+abi-identity","sdk_contract":"talon-native-manifest-v1"},"gates":{"storage_conditional_batch_v1":{"reason":"The outer signed gate remains closed until SDK cross-target admission; the Core self-manifest reports the implementation separately.","status":"gated"}},"materials":{"core_license":{"path":"LICENSE.core","sha256":"e6a6068e4e178bd5262e1e31a64576e68dd023316c3b20f68cc67f4962d2d53e","size":7771},"license_inventory":{"path":"libtalon-core-runtime-macos-arm64.licenses.json","sha256":"43bfb829a53a6ee766e09aa38a0fcdc76716de7ae7c542d5a0822d57aebe4acd","size":32404},"notice":{"path":"NOTICE","sha256":"8f2751adb0b5f4a47b2f82bedb79ae66559e8fb53808445c550d2314c8388ad1","size":787},"sbom":{"path":"libtalon-core-runtime-macos-arm64.sbom.cdx.json","sha256":"769155cddfdea2cbfe0c2296e454661caa9cda0a5a844712ca38c7cd551fec60","size":56604}},"release":{"channel":"enterprise-core","tag":"v0.1.55","talon_bin_commit":"8c32fca3b9b2cd71808d3c88bebb7c5e45ee82bf"},"schema_version":"1.0","signing":{"algorithm":"Ed25519","key_id":"talon-enterprise-core-2026-10-01","public_key_sha256":"617eca89ae8b1e824b5ae764cee171f98eff07e16123e7a0dbead73425b1fa2c","signature":"libtalon-core-runtime-macos-arm64.manifest.json.sig"},"source":{"cargo_lock_sha256":"9ce889e37a79fa45f26a8b66218c0c629d93638e576acd9e8c364527ff4fdda2","cargo_version":"0.1.2","clean":true,"commit":"2b3c6d368aad50fd869aaeff1cfefcca0ada160b","repository":"https://github.com/darkmice/talon-core","source_date_epoch":1791636333,"tag":"v0.1.2"}}
